{"artifact_type":"report-toolchain-authority-entry","authority_fingerprint":"feb6abd5dea694c23d4e94151ef09719f1a47e124a8d98a24d1f331a9c352f41","authority_id":"report-toolchain-authority:linux-x64:feb6abd5dea694c23d4e9415","offline_bundle":{"member_count":327,"total_bytes":45096797,"tree_sha256":"1d224c0e9a26652d51c531f78e15de5a361d7f6f9c3029486846cce90d272f11"},"pdf_render_backend":{"distribution":"pypdfium2","member_count":71,"total_bytes":8246892,"tree_sha256":"8fd9918ee271b5d94206c7f67cdf9535793da612e5e6038e92b0df0a82d85582","version":"5.13.0"},"pdf_text_backend":{"distribution":"pypdf","member_count":61,"total_bytes":1669716,"tree_sha256":"961bc9959bc04d33aef5f252a2095705d8983ff5d160ba6f4eba1f2b014f3795","version":"6.16.1"},"platform_target":"linux-x64","release_evidence_status":"ready","renderer":{"basename":"tectonic","engine":"tectonic","sha256":"93898e5680acc5ae857b96a3ac1447d84f3bb2eb8dd39398c9859e284afb5443","size":55785912,"version":"Tectonic 0.16.9"},"schema_version":"1.0.0","supply_chain":{"components":{"offline_bundle":{"component_name":"offline_bundle","derivation_manifest_path":"evidence/tectonic-cache-derivation.json","derivation_manifest_sha256":"7a354767cbdcf45f7ad061811283b7005d69ee17e71bf6d2ce7d0b9aad6a4ff4","download_sha256":"6ffe055852f8faf66c0acbe1a7fb27f87b869a90bad1204f3bf4d9683f597c7c","download_url":"https://relay.fullyjustified.net/default_bundle_v33.tar","license_inventory":[{"component_scope":"tectonic-default-bundle-v33-selective-cache","license_path":"evidence/offline_bundle.spdx.json","license_sha256":"08ed3afcefeb504847f9ce83192e9165068df93036f1d6dc493da13a13ca4987","spdx_license_id":"LicenseRef-TeX-Live-Mixed"}],"runtime_identity_sha256":"96f31c8a5ec0e30f3ac808889688a40cbb32d6b3637a4662d8cab622bc29ee31","sbom_path":"evidence/offline_bundle.spdx.json","sbom_sha256":"08ed3afcefeb504847f9ce83192e9165068df93036f1d6dc493da13a13ca4987","source_sha256":"6ffe055852f8faf66c0acbe1a7fb27f87b869a90bad1204f3bf4d9683f597c7c","source_url":"https://relay.fullyjustified.net/default_bundle_v33.tar"},"pdf_render_backend":{"component_name":"pdf_render_backend","derivation_manifest_path":"linux-x64-report-toolchain-evidence.json","derivation_manifest_sha256":"286e2db5562594d27c2da36a57adeaf7470093af9b6fa33b168d1754ccaf7669","download_sha256":"81df25c1ab4c13ff773102d3cbea1967511d079123b067fc077bd0c4d57d91d8","download_url":"https://files.pythonhosted.org/packages/d3/7c/74a2fb48e5b0d2402d9ca64b39074c722d67e9a8a2c58449a843a8c2329a/pypdfium2-5.13.0-py3-none-manylinux_2_17_x86_64.manylinux2014_x86_64.whl","license_inventory":[{"component_scope":"pypdfium2-and-pdfium","license_path":"evidence/pdf_render_backend.spdx.json","license_sha256":"fe39d89e828b5db495fa2a503143e52b8d59af08d4ac49633d7a9494236efa4e","spdx_license_id":"LicenseRef-PDFium-Build-License-Set"}],"runtime_identity_sha256":"741cadbe7d176c651fdc54b547c50ef116c29f6acf638e5c0c5ad4c773dbbf9c","sbom_path":"evidence/pdf_render_backend.spdx.json","sbom_sha256":"fe39d89e828b5db495fa2a503143e52b8d59af08d4ac49633d7a9494236efa4e","source_sha256":"7ca2d8e31bd8d0d40c496416b7d8bea423388669ffd494929f50e8c3a82326b8","source_url":"https://files.pythonhosted.org/packages/ec/78/a52cb80611339ec95f35c7a10d7bfe7a6f97f3b50a35a9f94283d062512e/pypdfium2-5.13.0.tar.gz"},"pdf_text_backend":{"component_name":"pdf_text_backend","derivation_manifest_path":"linux-x64-report-toolchain-evidence.json","derivation_manifest_sha256":"286e2db5562594d27c2da36a57adeaf7470093af9b6fa33b168d1754ccaf7669","download_sha256":"63fec31c4092ae50b6729beedcb469055b60d20c834bde1c402df241f371f644","download_url":"https://files.pythonhosted.org/packages/33/a1/724b18d6757ab7253a8fecd3a430eb8d980ed26872ba16651e7b5ddfc63f/pypdf-6.16.1-py3-none-any.whl","license_inventory":[{"component_scope":"pypdf","license_path":"evidence/pdf_text_backend.spdx.json","license_sha256":"35c8cd5c12e656e3efff2470018ff37a0269f7318c3acc4d7008dcbda3fbc0bf","spdx_license_id":"BSD-3-Clause"}],"runtime_identity_sha256":"ceec0f64a5e94cfbb0119caeeceb63485945b6c1d1990162ba160c269abfa35f","sbom_path":"evidence/pdf_text_backend.spdx.json","sbom_sha256":"35c8cd5c12e656e3efff2470018ff37a0269f7318c3acc4d7008dcbda3fbc0bf","source_sha256":"c4d1b43ddae921387321cf63936cd16a7743b91d2da92f165c149a195c972ba9","source_url":"https://files.pythonhosted.org/packages/b6/5a/df92d1c1ef8806ca28f20f978ee059894868d93de797a7e2edebe7fe1a43/pypdf-6.16.1.tar.gz"},"renderer":{"component_name":"renderer","derivation_manifest_path":"linux-x64-report-toolchain-evidence.json","derivation_manifest_sha256":"286e2db5562594d27c2da36a57adeaf7470093af9b6fa33b168d1754ccaf7669","download_sha256":"f3c825128095dc3399ea11c08c18035b33050a216930c295c79e8eb11bd21de4","download_url":"https://github.com/tectonic-typesetting/tectonic/releases/download/tectonic%400.16.9/tectonic-0.16.9-x86_64-unknown-linux-gnu.tar.gz","license_inventory":[{"component_scope":"tectonic","license_path":"evidence/renderer.spdx.json","license_sha256":"02f5b7e6f7a6e3f291fb6b2f4488c3624e074c9a779d8e5727b2111dfa6e677b","spdx_license_id":"MIT"}],"runtime_identity_sha256":"952a7c4a3c934a3718afea6062cb326ccaa301dacf9c2ad292c5584f91844439","sbom_path":"evidence/renderer.spdx.json","sbom_sha256":"02f5b7e6f7a6e3f291fb6b2f4488c3624e074c9a779d8e5727b2111dfa6e677b","source_sha256":"9861d4d4230b987d8560f1b84fe6c8a550738401be65b9425b0c7d0466178f2b","source_url":"https://codeload.github.com/tectonic-typesetting/tectonic/tar.gz/refs/tags/tectonic%400.16.9"}},"missing_evidence_codes":[],"status":"ready"}}
